ID,Tweet,Influenza,Diarrhea,Hayfever,Cough,Headache,Fever,Runnynose,Cold,labels,is_test
1954en,I woke up this morning with a splitting headache. This is bad.,0,0,0,0,1,0,0,0,Headache,True
1955en,I love photos of a dog with a runny nose.,0,0,0,0,0,0,0,0,sober,True
1956en,They say there's a flu shot shortage,0,0,0,0,0,0,0,0,sober,True
1957en,"Let's see which can cure my cold faster, the power of science or the power of human healing - go!",0,0,0,0,0,0,0,1,Cold,True
1958en,I can't go out much until I stop coughing.,0,0,0,1,0,0,0,0,Cough,True
1959en,It's proper etiquette to wear a mask when you have a cough.,0,0,0,1,0,0,0,0,Cough,True
1960en,The dog eagerly licks my snot.,0,0,0,0,0,0,1,0,Runnynose,True
1961en,"The fever medicine Suzuki gave me works crazy well, I got over my cold in no time",0,0,0,0,0,0,0,1,Cold,True
1962en,The train is running late and my nose started running,0,0,0,0,0,0,0,0,sober,True
1963en,The example sentence for the English word for diarrhea is hilarious! Haha!,0,0,0,0,0,0,0,0,sober,True
1964en,I remember the time a group of us got food poisoning from the lunch service and it gave me bad diarrhea.,0,0,0,0,0,0,0,0,sober,True
1965en,"I have the flu, so I can't go out for a while.",1,0,0,0,0,1,0,0,Influenza;Fever,True
1966en,I caught a cold and took a decongestant.,0,0,0,0,0,0,1,1,Runnynose;Cold,True
1967en,Are eczema sufferers more likely to have allergies?,0,0,0,0,0,0,0,0,sober,True
1968en,My nose is runny. I feel out of it and my head's started to hurt. Probably headache medicine will work better than cold medicine.,0,0,0,0,1,0,1,0,Headache;Runnynose,True
1969en,"My headache isn't getting any better, so I'm gonna see a doctor",0,0,0,0,1,0,0,0,Headache,True
1970en,Coughing and phlegm can be managed by washing your hands and gargling. ,0,0,0,1,0,0,0,0,Cough,True
1971en,"It's almost time for finals, and I caught a cold. I feel out of it and when I study I can't concentrate at all. This is terrible.",0,0,0,0,0,0,0,1,Cold,True
1972en,Any recommendations for cold medicine?,0,0,0,0,0,0,1,1,Runnynose;Cold,True
1973en,"The doctor told me to sleep, but I played a game and now I have a headache.",0,0,0,0,1,0,0,0,Headache,True
1974en,"My wife's allergies are acting up, it seems rough.",0,0,1,0,0,0,1,0,Hayfever;Runnynose,True
1975en,My cell phone is hot lately. Time to exchange it for a new one.,0,0,0,0,0,0,0,0,sober,True
1976en,"The flu is going around, so I'm even scared to shake hands. ",0,0,0,0,0,0,0,0,sober,True
1977en,I wish I could get a flu shot for cheap.,0,0,0,0,0,0,0,0,sober,True
1978en,"I've vanquished my fever, but it didn't work on my cough and phlegm.",0,0,0,1,0,0,0,0,Cough,True
1979en,"Watching the news on bird flu, I feel bad for the birds.",0,0,0,0,0,0,0,0,sober,True
1980en,I've had a stuffy nose all day long...,0,0,0,0,0,0,1,0,Runnynose,True
1981en,People who have really bad headaches need more than medicine to cure them,0,0,0,0,1,0,0,0,Headache,True
1982en,I wonder how you say diarrhea in English.,0,0,0,0,0,0,0,0,sober,True
1983en,"Apparently birds get the flu, too. Scary",0,0,0,0,0,0,0,0,sober,True
1984en,"Even though it's allergies, having a runny nose makes me feel like I have a fever.",0,0,1,0,0,1,1,0,Hayfever;Fever;Runnynose,True
1985en,"Apparently there's a mumps outbreak in Spain, take care of yourself!",0,0,0,0,0,0,0,0,sober,True
1986en,"I got diarrhea today and couldn't eat anything this morning, now I'm starving like crazy.",0,1,0,0,0,0,0,0,Diarrhea,True
1987en,"I took medicine, and before I knew it my nose had stopped running!",0,0,0,0,0,0,1,0,Runnynose,True
1988en,I think I coughed too much. My stomach muscles hurt.,0,0,0,1,0,0,0,0,Cough,True
1989en,I have a super runny nose. There's no way I can go.,0,0,0,0,0,0,1,0,Runnynose,True
1990en,It's almost the flu season.,0,0,0,0,0,0,0,0,sober,True
1991en,My cell phone was hot so I put it somewhere it can cool,0,0,0,0,0,0,0,0,sober,True
1992en,"I can't take this runny nose any more, so I bought medicine. I'm sleepy.",0,0,0,0,0,0,1,0,Runnynose,True
1993en,I want some medicine for this head cold,0,0,0,0,0,0,1,1,Runnynose;Cold,True
1994en,I felt like I had diarrhea when I woke up. Ugh.,0,1,0,0,0,0,0,0,Diarrhea,True
1995en,Stuffy nose. I can't breathe!,0,0,0,0,0,0,1,0,Runnynose,True
1996en,"Whenever I eat extremely spicy Nepali food, I get diarrhea after.",0,0,0,0,0,0,0,0,sober,True
1997en,"Lots of people are wearing masks, I guess it's flu season.",0,0,0,0,0,0,0,0,sober,True
1998en,I took flu medicine and was better in no time ,1,0,0,0,0,1,0,0,Influenza;Fever,True
1999en,This headache really hurts,0,0,0,0,1,0,0,0,Headache,True
2000en,"I heard that there's a cold going around in Spain, you okay??",0,0,0,0,0,0,0,0,sober,True
2001en,"Bird flu again, scary",0,0,0,0,0,0,0,0,sober,True
2002en,This cough is so bad. My stomach muscles hurt.,0,0,0,1,0,0,0,0,Cough,True
2003en,Not a lot of people stay home from school due to allergies.,0,0,0,0,0,0,0,0,sober,True
2004en,"My big brother got the flu, so I'm scared he might give it to me.",1,0,0,0,0,1,0,0,Influenza;Fever,True
2005en,"I feel sleepy and out of it, I'm pretty sure it's a cold.",0,0,0,0,0,0,0,1,Cold,True
2006en,Somebody cast a spell to make this head cold go away!! ,0,0,0,0,0,0,1,1,Runnynose;Cold,True
2007en,"Even if I catch a cold, even if my fever goes down, I keep updating my blog. Being that obsessive, maybe I really am sick.",0,0,0,0,0,0,0,0,sober,True
2008en,I've had a bad headache since this morning. It's been a while since I had one this painful.,0,0,0,0,1,0,0,0,Headache,True
2009en,"I have chills, it's gotta be a cold. This seriously sucks.",0,0,0,0,0,0,0,1,Cold,True
2010en,"Nose running like a faucet, a temperature of 104. Diarrhea really wears you out.",0,1,0,0,0,1,1,0,Diarrhea;Fever;Runnynose,True
2011en,"I'm so happy, my stuffy nose is gone",0,0,0,0,0,0,0,0,sober,True
2012en,What I thought was just a cold turns out to be mumps. ,0,0,0,0,0,0,0,0,sober,True
2013en,"My big brother got the flu at his club, ha!",1,0,0,0,0,1,0,0,Influenza;Fever,True
2014en,"I'm coughing up phlegm, maybe it's because I'm exhausted.",0,0,0,1,0,0,0,0,Cough,True
2015en,"I can't stop sneezing, could be allergies",0,0,1,0,0,0,1,0,Hayfever;Runnynose,True
2016en,"No sign of the coughing or phlegm stopping, somebody tell me when it will stop.",0,0,0,1,0,0,0,0,Cough,True
2017en,Awful diarrhea... Might be the seafood I ate yesterday.,0,1,0,0,0,0,0,0,Diarrhea,True
2018en,"I held in my cough, and now I have a stomach cramp. Ow...",0,0,0,1,0,0,0,0,Cough,True
2019en,Nasal sprays are marvelous.,0,0,0,0,0,0,1,0,Runnynose,True
2020en,I have a headache from thinking too much about outer space.,0,0,0,0,0,0,0,0,sober,True
2021en,I have a fever and swollen lymph nodes.,0,0,0,0,0,1,0,0,Fever,True
2022en,I'm coughing so much my stomach muscles hurt.,0,0,0,1,0,0,0,0,Cough,True
2023en,"My cold is totally gone, I'm going to rock it today!",0,0,0,0,0,0,0,0,sober,True
2024en,"If an adult gets the mumps, it's really bad.",0,0,0,0,0,0,0,0,sober,True
2025en,Looks like my allergies are already acting up. It's mentally and physically tiring.,0,0,1,0,0,0,1,0,Hayfever;Runnynose,True
2026en,"I have a temperature and a cough, this sucks",0,0,0,1,0,1,0,0,Cough;Fever,True
2027en,"I'm home, but my head still hurts.",0,0,0,0,1,0,0,0,Headache,True
2028en,What are the options for good cold medicine?,0,0,0,0,0,0,1,1,Runnynose;Cold,True
2029en,Do shrimp get the flu?,0,0,0,0,0,0,0,0,sober,True
2030en,Cases of bird flu have appeared again this year...,0,0,0,0,0,0,0,0,sober,True
2031en,"It's a season of cold wintry winds, and even a dog playing outside will get a runny nose.",0,0,0,0,0,0,0,0,sober,True
2032en,"Uh-oh, a little longer and I might not have been able to hold in my diarrhea.",0,1,0,0,0,0,0,0,Diarrhea,True
2033en,"He went home a bit ago, said he had a headache or something. The doctor said not to take a bath, so he should go straight to sleep.",0,0,0,0,1,0,0,0,Headache,True
2034en,They say that there are headaches that will get better and headaches that will get worse by warming up in the bath.,0,0,0,0,1,0,0,0,Headache,True
2035en,It's effective for eczema and allergy sufferers.,0,0,0,0,0,0,0,0,sober,True
2036en,There is such a thing as coughing etiquette. I make sure to wash my hands after using them to cover my mouth.,0,0,0,1,0,0,0,0,Cough,True
2037en,"I have a splitting headache, so I just got home.",0,0,0,0,1,0,0,0,Headache,True
2038en,Somebody's here even though I feel feverish.,0,0,0,0,0,1,0,0,Fever,True
2039en,"I thought it'd get better if I slept, but I woke up this morning and still have a headache. I hate this.",0,0,0,0,1,0,0,0,Headache,True
2040en,This headache is making my whole body feel weak.,0,0,0,0,1,0,0,0,Headache,True
2041en,This cough is so bad my chest hurts.,0,0,0,1,0,0,0,0,Cough,True
2042en,Diarrhea again today. I don't want to go to work.,0,1,0,0,0,0,0,0,Diarrhea,True
2043en,It's been pretty rough because of this fever and cough.,0,0,0,1,0,1,0,0,Cough;Fever,True
2044en,"Ugh, this cold has been hanging on forever. I catch colds more often since coming to Tokyo... I want to go to my parents' house and play with the dog...",0,0,0,0,0,0,1,1,Runnynose;Cold,True
2045en,"I think I have a cold, I feel out of it.",0,0,0,0,0,0,0,1,Cold,True
2046en,I'll do anything if it'll help my relieve my allergy symptoms,0,0,1,0,0,0,1,0,Hayfever;Runnynose,True
2047en,"I'm tired and feverish from this cold, so I wasn't going to go to the New Years party, but I was forced to attend.",0,0,0,0,0,1,0,1,Fever;Cold,True
2048en,I'm beat. I can't stop coughing.,0,0,0,1,0,0,0,0,Cough,True
2049en,What's up with staying home just 'cause of a head cold?,0,0,0,0,0,0,1,1,Runnynose;Cold,True
2050en,"Hey, hey, hey. This is bad, diarrhea?",0,1,0,0,0,0,0,0,Diarrhea,True
2051en,"My little brother has a fever, so I took care of him!",0,0,0,0,0,1,0,0,Fever,True
2052en,I have terrible diarrhea and can't work. ,0,1,0,0,0,0,0,0,Diarrhea,True
2053en,"Wow, about 100 million people died from Spanish flu.",0,0,0,0,0,0,0,0,sober,True
2054en,"I got tested for the flu, but it was negative.",0,0,0,0,0,0,0,0,sober,True
2055en,"When I get a mild fever from allergies, I can't think.",0,0,1,0,0,1,1,0,Hayfever;Fever;Runnynose,True
2056en,The news on my cell phone says this year's cold season there's going to be a bug going around that gives people a fever,0,0,0,0,0,0,0,0,sober,True
2057en,There's a diarrhea outbreak in my class,0,1,0,0,0,0,0,0,Diarrhea,True
2058en,I can't do karaoke when I have a runny nose.,0,0,0,0,0,0,1,0,Runnynose,True
2059en,"Thanks to science developing good medicines, sicknesses like the cold get better quickly.",0,0,0,0,0,0,0,0,sober,True
2060en,"When I hear a high-pitched sound, it echoes in my head and makes my headache worse.",0,0,0,0,1,0,0,0,Headache,True
2061en,This cold is making me tired. I can't wait to rest.,0,0,0,0,0,0,0,1,Cold,True
2062en,"I read on a blog that when a child has a stuffy nose you can suck it out, and I thought, no way. I mean, that's bodily fluid, you know? Even if it really works, I'm not doing it!",0,0,0,0,0,0,0,0,sober,True
2063en,I wonder if everyone is maintaining good personal hygiene habits to protect against the flu?,0,0,0,0,0,0,0,0,sober,True
2064en,"This cold is rough. I've got a headache too, it might not be an ordinary cold. Yikes.",0,0,0,0,1,0,1,1,Headache;Runnynose;Cold,True
2065en,A runny nose and a cold are related.,0,0,0,0,0,0,1,1,Runnynose;Cold,True
2066en,"Next spring there isn't supposed to be a lot of cedar pollen, so maybe my allergies won't be so bad.",0,0,0,0,0,0,0,0,sober,True
2067en,"Going to Nepal, we all got diarrhea.",0,0,0,0,0,0,0,0,sober,True
2068en,My big brother got the flu.,1,0,0,0,0,1,0,0,Influenza;Fever,True
2069en,There are supposed to be fewer allergy sufferers this year.,0,0,0,0,0,0,0,0,sober,True
2070en,I got diarrhea after eating the oyako don my grandma made,0,1,0,0,0,0,0,0,Diarrhea,True
2071en,"My daughter and wife both have temperatures, so I'm staying home from work today to look after them.",0,0,0,0,0,1,0,0,Fever,True
2072en,"When you have a cough, you have to be courteous and wear a mask.",0,0,0,1,0,0,0,0,Cough,True
2073en,I coughed and in my sleep said mask.,0,0,0,1,0,0,0,0,Cough,True
2074en,I put on a mask and am equipped with headache medicine.,0,0,0,0,1,0,0,0,Headache,True
2075en,Someone is coughing deliberately,0,0,0,1,0,0,0,0,Cough,True
2076en,Food poisoning? I have diarrhea that won't go away.,0,1,0,0,0,0,0,0,Diarrhea,True
2077en,I got the flu and my temperature is over 100.,1,0,0,0,0,1,0,0,Influenza;Fever,True
2078en,I wonder how you say diarrhea in English?,0,0,0,0,0,0,0,0,sober,True
2079en,"This is awful, catching a cold at a busy time like this!",0,0,0,0,0,0,0,1,Cold,True
2080en,You know you've got a bad stuffy nose that makes the people around you go what the hell..,0,0,0,0,0,0,1,0,Runnynose,True
2081en,The TV said this year there's a cold going around where you don't get a fever.,0,0,0,0,0,0,0,0,sober,True
2082en,"A cold! Yes, I get to stay home from school!",0,0,0,0,0,0,0,1,Cold,True
2083en,"When people say they have a fever but it's okay, is it really okay?",0,0,0,0,0,1,0,0,Fever,True
2084en,I get a lot of stomachaches lately. I have diarrhea constantly too.,0,1,0,0,0,0,0,0,Diarrhea,True
2085en,Please cast a spell so my nose will stop running.,0,0,0,0,0,0,1,0,Runnynose,True
2086en,Urgently wanted: effective ways to cure a headache. ,0,0,0,0,1,0,0,0,Headache,True
2087en,I wish I could stay home. This cold makes feel lousy.,0,0,0,0,0,0,0,1,Cold,True
2088en,"Listening to classical music gives me a headache, it is sheer pain",0,0,0,0,1,0,0,0,Headache,True
2089en,I just saw on the news that communicable diseases give you a fever. ,0,0,0,0,0,0,0,0,sober,True
2090en,"A cold at a time like this, before an important test. This is the worst.",0,0,0,0,0,0,0,1,Cold,True
2091en,"My headache isn't as bad as it was earlier, but I'm going home and going to bed.",0,0,0,0,1,0,0,0,Headache,True
2092en,"I've been coughing like crazy, so I have to make sure I wash my hands.",0,0,0,1,0,0,0,0,Cough,True
2093en,"Apparently there are allergies in the fall, too.",0,0,0,0,0,0,0,0,sober,True
2094en,"My stomach hurts and I feel like I have diarrhea, maybe there was something in the food I ate at lunch. ",0,1,0,0,0,0,0,0,Diarrhea,True
2095en,I never thought I'd get allergies.,0,0,1,0,0,0,1,0,Hayfever;Runnynose,True
2096en,I'm going to build a body that can beat the flu.,0,0,0,0,0,0,0,0,sober,True
2097en,"When you have a cough with phlegm that lasts a while, it's really tiring because you use your stomach muscles.",0,0,0,1,0,0,0,0,Cough,True
2098en,"I caught a cold so I took medicine, but the one thing it didn't cure is my runny nose. I'm wish I could rest for the rest of the day.",0,0,0,0,0,0,1,1,Runnynose;Cold,True
2099en,"I have a cold and feel sick, but I can't stay home.",0,0,0,0,0,0,0,1,Cold,True
2100en,"I get drowsy when I take decongestants, you see. ",0,0,0,0,0,0,1,0,Runnynose,True
2101en,I have to buy stuffy nose strips.,0,0,0,0,0,0,1,0,Runnynose,True
2102en,I got a cold in Spain.,0,0,0,0,0,0,0,0,sober,True
2103en,"The way this headache feels, it's definitely a cold.",0,0,0,0,1,0,0,1,Headache;Cold,True
2104en,Someone tell me how to cure a stuffy nose.,0,0,0,0,0,0,1,0,Runnynose,True
2105en,A headache in the morning. I drank too much.,0,0,0,0,1,0,0,0,Headache,True
2106en,"Whenever I get diarrhea, what I think of is a bathroom with no toilet paper.",0,1,0,0,0,0,0,0,Diarrhea,True
2107en,My TV is giving off an awful lot of heat. Is it okay? Seriously.,0,0,0,0,0,0,0,0,sober,True
2108en,I don't want to remember getting diarrhea from the food poisoning outbreak.,0,0,0,0,0,0,0,0,sober,True
2109en,"Oh, no! Yamada has a cold.",0,0,0,0,0,0,0,1,Cold,True
2110en,I'm getting tested for the flu.,0,0,0,0,0,0,0,0,sober,True
2111en,I was shocked to find it was bird flu.,0,0,0,0,0,0,0,0,sober,True
2112en,"At last, there's blood mixed with my phlegm...",0,0,0,1,0,0,0,0,Cough,True
2113en,"My brother got the flu, and now the whole family has it.",1,0,0,0,0,1,0,0,Influenza;Fever,True
2114en,I've had a little diarrhea ever since coming back from Nepal. Maybe I got a funny bug.,0,1,0,0,0,0,0,0,Diarrhea,True
2115en,I'm gonna wash my hands and gargle so I don't cough!,0,0,0,0,0,0,0,0,sober,True
2116en,"My fever is down, but I can't stop coughing. I can't take it anymore, my stomach muscles hurt.",0,0,0,1,0,0,0,0,Cough,True
2117en,I wonder if the method they showed on TV yesterday for treating allergies really works?,0,0,0,0,0,0,0,0,sober,True
2118en,I get a headache when I think too hard about outer space.,0,0,0,0,0,0,0,0,sober,True
2119en,"Ugh, I have a headache and chills because of this cold, I'm so out of it",0,0,0,0,1,0,0,1,Headache;Cold,True
2120en,"By the way, what can I do to manage a headache?",0,0,0,0,1,0,0,0,Headache,True
2121en,I wonder if you can catch the flu just from shaking hands?,0,0,0,0,0,0,0,0,sober,True
2122en,"Now I have a headache on top of the stuffy nose, I'm staying home from school",0,0,0,0,1,0,1,0,Headache;Runnynose,True
2123en,"My daughter has a fever but apparently can't stay home from work, I don't get it",0,0,0,0,0,1,0,0,Fever,True
2124en,"At last, for the first time I too have allergies!",0,0,1,0,0,0,1,0,Hayfever;Runnynose,True
2125en,"I couldn't stop coughing in class, then my friend next to me said I was doing it on purpose, ugh.",0,0,0,1,0,0,0,0,Cough,True
2126en,"When I have a headache, hearing applause makes it worse.",0,0,0,0,1,0,0,0,Headache,True
2127en,Flu season is coming again.,0,0,0,0,0,0,0,0,sober,True
2128en,I've had diarrhea since morning.,0,1,0,0,0,0,0,0,Diarrhea,True
2129en,"When I went to Nepal, the food didn't agree with me, and I got an upset stomach and diarrhea...",0,0,0,0,0,0,0,0,sober,True
2130en,"I have a runny, stuffy nose, in other words, a head cold. I don't have a fever, but there's no way I can handle club activities.",0,0,0,0,0,0,1,1,Runnynose;Cold,True
2131en,I hear a new bug was brought over from Spain.,0,0,0,0,0,0,0,0,sober,True
2132en,"Of all the symptoms, I really want to get rid of a stuffy nose.",0,0,0,0,0,0,1,0,Runnynose,True
2133en,The headache is a bigger problem than the fever.,0,0,0,0,1,1,0,0,Headache;Fever,True
2134en,I feel out of it because of this cold. I'm exhuasted!,0,0,0,0,0,0,0,1,Cold,True
2135en,"This headache is intense, so I'm going home and going to bed.",0,0,0,0,1,0,0,0,Headache,True
2136en,Millennials get a cough or some phlegm and that's all it takes for them to stay home from work.,0,0,0,1,0,0,0,0,Cough,True
2137en,"My stomach's been wonky lately. Like today, I had diarrhea in the morning and haven't been feeling well.",0,1,0,0,0,0,0,0,Diarrhea,True
2138en,"I got a flu shot at work. I'm relieved, it didn't hurt as much as I thought it would.",0,0,0,0,0,0,0,0,sober,True
2139en,I get a headache when I think about who I'm going to meet.,0,0,0,0,0,0,0,0,sober,True
2140en,I need medicine that works well on bad headaches,0,0,0,0,1,0,0,0,Headache,True
2141en,My stomach hurts from coughing so much,0,0,0,1,0,0,0,0,Cough,True
2142en,"Got the flu, taking care of your health is important.",1,0,0,0,0,1,0,0,Influenza;Fever,True
2143en,"I've had a slight fever lately and it turns out to be allergies, which I wasn't expecting.",0,0,1,0,0,1,1,0,Hayfever;Fever;Runnynose,True
2144en,"It was a buffet, so I had a little too much to eat, and now I feel sick, my stomach hurts and I think I have diarrhea.",0,1,0,0,0,0,0,0,Diarrhea,True
2145en,I might have the flu so I'm thinking I'll skip the club meeting.,0,0,0,0,0,0,0,0,sober,True
2146en,My colds start with a runny nose.,0,0,0,0,0,0,1,1,Runnynose;Cold,True
2147en,"I'm going on a trip tomorrow, but I have chills... could it be a cold? This sucks.",0,0,0,0,0,0,0,1,Cold,True
2148en,"This cold is making me sleepy, but I drank something and now I feel perfect",0,0,0,0,0,0,0,1,Cold,True
2149en,I have the worst runny nose because of this cold.,0,0,0,0,0,0,1,1,Runnynose;Cold,True
2150en,"Yikes, I was on the phone and now my cell phone is hot",0,0,0,0,0,0,0,0,sober,True
2151en,"I caught a cold and my temperature is up, so I'm taking some fever medicine ASAP.",0,0,0,0,0,1,0,1,Fever;Cold,True
2152en,"I have an awful cough and fever, I have no choice but to stay home from work when I'm like this.",0,0,0,1,0,1,0,0,Cough;Fever,True
2153en,My big brother got the flu and has been ordered not to leave the house.,1,0,0,0,0,1,0,0,Influenza;Fever,True
2154en,I have constant diarrhea lately,0,1,0,0,0,0,0,0,Diarrhea,True
2155en,It was diarrhea that woke me up in the middle of the night,0,1,0,0,0,0,0,0,Diarrhea,True
2156en,I wonder if dogs get colds too,0,0,0,0,0,0,0,0,sober,True
2157en,My big brother got the flu.,1,0,0,0,0,1,0,0,Influenza;Fever,True
2158en,"Hey, this medicine is supposed to get rid of mucus",0,0,0,1,0,0,0,0,Cough,True
2159en,"The flu is supposed to be going around this season, so get a shot ASAP.",0,0,0,0,0,0,0,0,sober,True
2160en,My nose is too stuffy to play any instrument.,0,0,0,0,0,0,1,0,Runnynose,True
2161en,My wife's allergies are acting up.,0,0,1,0,0,0,1,0,Hayfever;Runnynose,True
2162en,I have a slight fever and I'm tired because of allergies,0,0,1,0,0,1,1,0,Hayfever;Fever;Runnynose,True
2163en,I went to walk the dog and caught a cold,0,0,0,0,0,0,1,1,Runnynose;Cold,True
2164en,It's been a while since my allergies acted up.,0,0,1,0,0,0,1,0,Hayfever;Runnynose,True
2165en,"I thought I had the flu so I went to the doctor, but I got tested and I was wrong.",0,0,0,0,0,0,0,0,sober,True
2166en,"I have a fever and a runny nose, and my stomach isn't doing great either.",0,1,0,0,0,1,1,0,Diarrhea;Fever;Runnynose,True
2167en,I hear that scientists developed a new fever medicine for colds.,0,0,0,0,0,0,0,0,sober,True
2168en,I have a fever and can't stop coughing.,0,0,0,1,0,1,0,0,Cough;Fever,True
2169en,I got a flu shot,0,0,0,0,0,0,0,0,sober,True
2170en,"By the way, what can I do to alleviate my headache other than taking medicine?",0,0,0,0,1,0,0,0,Headache,True
2171en,I never thought I'd get allergies.,0,0,1,0,0,0,1,0,Hayfever;Runnynose,True
2172en,Somebody tell me how to cure a runny nose.,0,0,0,0,0,0,1,0,Runnynose,True
2173en,I have terrible diarrhea and can't leave the bathroom,0,1,0,0,0,0,0,0,Diarrhea,True
2174en,"Diarrhea the second I wake up, is this bad?",0,1,0,0,0,0,0,0,Diarrhea,True
2175en,"I was listening to music with headphones and gradually got a headache. Looking at it carefully, the frame is slightly bent, maybe it applied pressure.",0,0,0,0,0,0,0,0,sober,True
2176en,"With my out-of-it head, I just figured it out, I have a cold.",0,0,0,0,0,0,0,1,Cold,True
2177en,I'm coughing so much I think my stomach muscles might die.,0,0,0,1,0,0,0,0,Cough,True
2178en,"Uh-oh, I have diarrhea today and can't leave the bathroom.",0,1,0,0,0,0,0,0,Diarrhea,True
2179en,"I thought I was feeling cold this morning, turned out to be diarrhea. My stomach hurts.",0,1,0,0,0,0,0,0,Diarrhea,True
2180en,"I have a fever, but it's no problem. I'm definitely going to the party tonight.",0,0,0,0,0,1,0,0,Fever,True
2181en,"My nose won't stop running, which got me wondering if I have a fever, but as it turns out I definitely do not.",0,0,0,0,0,0,1,0,Runnynose,True
2182en,My grandma just got back and I asked her how she says diarrhea in English and she burst out laughing.,0,0,0,0,0,0,0,0,sober,True
2183en,"It sucks when you get the wrong type of flu shot, because it won't work.",0,0,0,0,0,0,0,0,sober,True
2184en,I had an incoming message for the first time in so long that my nose started running.,0,0,0,0,0,0,0,0,sober,True
2185en,I'm out of it because of a cold.,0,0,0,0,0,0,0,1,Cold,True
2186en,I wonder how you say diarrhea in English?,0,0,0,0,0,0,0,0,sober,True
2187en,"My stomach started hurting a little while ago, hopefully it's not diarrhea.",0,1,0,0,0,0,0,0,Diarrhea,True
2188en,"When I get the flu, my throat is dry before long. I wonder if it'll get better before long if I guzzle Pocari Sweat.",1,0,0,0,0,1,0,0,Influenza;Fever,True
2189en,I woke up this morning with the worst headache.,0,0,0,0,1,0,0,0,Headache,True
2190en,"I've been super tired since the morning, I wonder if it's a cold? ",0,0,0,0,0,0,0,1,Cold,True
2191en,Is there anything I can do to prevent headaches?,0,0,0,0,1,0,0,0,Headache,True
2192en,"I had a fever and made myself go to work, which made it worse. I went to the doctor, and was lectured for waiting so long to come in.",0,0,0,0,0,1,0,0,Fever,True
2193en,"When I'm too tired to get up in the morning, I rub the thermometer and make it look like I have a temperature, so everybody thinks I'm sick, and I can definitely stay home without getting caught. It's perfect.",0,0,0,0,0,0,0,0,sober,True
2194en,My diarrhea went away when I played soccer,0,0,0,0,0,0,0,0,sober,True
2195en,"The people who are saying there's not a lot of pollen today don't have allergies, so...",0,0,1,0,0,0,1,0,Hayfever;Runnynose,True
2196en,It's common courtesy to not face another person when you cough,0,0,0,1,0,0,0,0,Cough,True
2197en,I'm thinking about what I can do to combat allergies.,0,0,0,0,0,0,0,0,sober,True
2198en,"The medicine is working, my fever is under control, and I can finally sleep.",0,0,0,0,0,1,0,0,Fever,True
2199en,I'm going to try fasting as a way to combat allergies.,0,0,1,0,0,0,1,0,Hayfever;Runnynose,True
2200en,It'd be a disaster if there was a Spanish flu outbreak.,0,0,0,0,0,0,0,0,sober,True
2201en,"I got the flu and it's nice to not have to go to school, but I hate that I'm missing the club meeting.",1,0,0,0,0,1,0,0,Influenza;Fever,True
2202en,I feel like all my bodily fluid is turning into mucus,0,0,0,0,0,0,1,0,Runnynose,True
2203en,I just got a flu shot!,0,0,0,0,0,0,0,0,sober,True
2204en,I noticed my lymph nodes were swollen. It turns out I have a fever.,0,0,0,0,0,1,0,0,Fever,True
2205en,"I'm so congested, I feel like I'm dying.",0,0,0,0,0,0,1,0,Runnynose,True
2206en,I wonder how you say diarrhea in English?,0,0,0,0,0,0,0,0,sober,True
2207en,My nose stopped running! I'm so happy!,0,0,0,0,0,0,0,0,sober,True
2208en,They say there's a bug going around in Spain,0,0,0,0,0,0,0,0,sober,True
